https://twitter.com/UTK_TCE/status/1258403995950948353,2020-05-07T14:31:07+00:00,"#UTGrad2020 — Join us for our virtual #EngineeringVols commencement. https://t.co/bp5sJTpVIn. Enjoy these words about our most stellar grads from our Dean Janis Terpenny, Associate Dean Ozlem Kilic,  and Lt. Col. Matthew Castillo. 
https://t.co/Q0CBKZUc3O","#UTGrad2020 — Join us for our virtual #EngineeringVols commencement. virtualgrad.marchingorder.com/utk/ii/. Enjoy these words about our most stellar grads from our Dean Janis Terpenny, Associate Dean Ozlem Kilic,  and Lt. Col. Matthew Castillo. 
youtu.be/5lbzSMHXhLM",1258403995950948400,UTK_TCE,UTK TCE,2364325579,"Official Twitter for the Tickle College of Engineering at the University of Tennessee, Knoxville.","Official Twitter for the Tickle College of Engineering at the University of Tennessee, Knoxville.",false,2014-02-27T15:22:23+00:00,2018,471,4840,10109,28,649,"Knoxville, TN",false,http://tickle.utk.edu,https://t.co/5K4ka5QzAp,https://pbs.twimg.com/profile_images/1300820597350506502/UfcjG-y-_normal.jpg,https://pbs.twimg.com/profile_banners/2364325579/1598974346,http://virtualgrad.marchingorder.com/utk/ii/,https://t.co/bp5sJTpVIn,0,0,2,0,1258403995950948400,en,"<a href=""https://mobile.twitter.com"" rel=""nofollow"">Twitter Web App</a>",https://mobile.twitter.com,Twitter Web App,,,,,,,,,,,,,,,,,,,,,,,,,,,,,,,,,,,,,,,,,,,,,,,,,,,,,,,,,,,,,,,,,,,,,,,,,,,,,,,,,,,,,,,,,,,,,,,,,,,,,,,,,,,,,,,,,,,,,,,,,,,,,,,,,,,,,,,,,,,,,,,,,,,,,,,,,,,,,,,,,,,,,,,,,,,,,,,,,,,,,,,,,,,,,,,,,,,,,,,,,,,,,,,,,,,,,,,,,,,,,,,,,,,,,,,,,,,,,,,,,,,,,,,,,,,,,,,,,,,,,,,,,,,,,,,,,,,,,,,,,,,,,,,,,,,,,,,,,,,https://youtu.be/5lbzSMHXhLM,https://t.co/Q0CBKZUc3O,,,,,,,,,,,,,,,,,,,,,,,,,,,,,,,,,,,,,,,,,,,,,,,,,,,,,,,,,,,,,,,,,,,,,,,,,,,,,,,,,,,,,,,,,,,,,,,,,,,,,,,,
https://twitter.com/UTK_TCE/status/1258403158403026944,2020-05-07T14:27:47+00:00,"#UTGrad2020 — Join us for our virtual #EngineeringVols commencement: https://t.co/bp5sJTpVIn. Here are Big Orange messages from Provost @dmanderscheid, @UT_President Randy Boyd, and Chancellor @DondePlowman. https://t.co/xKEddWzzw1","#UTGrad2020 — Join us for our virtual #EngineeringVols commencement: virtualgrad.marchingorder.com/utk/ii/. Here are Big Orange messages from Provost @dmanderscheid, @UT_President Randy Boyd, and Chancellor @DondePlowman. youtu.be/LMyfkMKTjNY",1258403158403027000,UTK_TCE,UTK TCE,2364325579,"Official Twitter for the Tickle College of Engineering at the University of Tennessee, Knoxville.","Official Twitter for the Tickle College of Engineering at the University of Tennessee, Knoxville.",false,2014-02-27T15:22:23+00:00,2018,471,4840,10109,28,649,"Knoxville, TN",false,http://tickle.utk.edu,https://t.co/5K4ka5QzAp,https://pbs.twimg.com/profile_images/1300820597350506502/UfcjG-y-_normal.jpg,https://pbs.twimg.com/profile_banners/2364325579/1598974346,http://virtualgrad.marchingorder.com/utk/ii/,https://t.co/bp5sJTpVIn,0,1,6,0,1258403158403027000,en,"<a href=""https://mobile.twitter.com"" rel=""nofollow"">Twitter Web App</a>",https://mobile.twitter.com,Twitter Web App,,,,,,dmanderscheid,David Manderscheid,45222222,,,,,,,,,,,,,,,,,,UT_President,UT System President Randy Boyd,1064549642661175300,,,,,,,,,,,,,,,,,,DondePlowman,Donde Plowman,223444411,,,,,,,,,,,,,,,,,,,,,,,,,,,,,,,,,,,,,,,,,,,,,,,,,,,,,,,,,,,,,,,,,,,,,,,,,,,,,,,,,,,,,,,,,,,,,,,,,,,,,,,,,,,,,,,,,,,,,,,,,,,,,,,,,,,,,,,,,,,,,,,,,,,,,,,,,,,,,,,,,,,,,,,,,,,,,,,,,,,,,,,,,,,,,,,,,,,,,,,,,,,,,,,,,,,,,,,,,,,,,,,,,,,,,,,,,,,,,,,,,,,,,,,,,,,https://youtu.be/LMyfkMKTjNY,https://t.co/xKEddWzzw1,,,,,,,,,,,,,,,,,,,,,,,,,,,,,,,,,,,,,,,,,,,,,,,,,,,,,,,,,,,,,,,,,,,,,,,,,,,,,,,,,,,,,,,,,,,,,,,,,,,,,,,,
https://twitter.com/UTK_TCE/status/1258381198201626624,2020-05-07T13:00:31+00:00,"Congratulations to our graduating #EngineeringVols and welcome to our spring 2020 virtual commencement: https://t.co/bp5sJTpVIn 
We are so proud of our students who are graduating today. Go Vols! #UTGrad2020 https://t.co/esaI77YIih","Congratulations to our graduating #EngineeringVols and welcome to our spring 2020 virtual commencement: virtualgrad.marchingorder.com/utk/ii/ 
We are so proud of our students who are graduating today. Go Vols! #UTGrad2020 https://t.co/esaI77YIih",1258381198201626600,UTK_TCE,UTK TCE,2364325579,"Official Twitter for the Tickle College of Engineering at the University of Tennessee, Knoxville.","Official Twitter for the Tickle College of Engineering at the University of Tennessee, Knoxville.",false,2014-02-27T15:22:23+00:00,2018,471,4840,10109,28,649,"Knoxville, TN",false,http://tickle.utk.edu,https://t.co/5K4ka5QzAp,https://pbs.twimg.com/profile_images/1300820597350506502/UfcjG-y-_normal.jpg,https://pbs.twimg.com/profile_banners/2364325579/1598974346,http://virtualgrad.marchingorder.com/utk/ii/,https://t.co/bp5sJTpVIn,0,5,18,2,1258381198201626600,en,"<a href=""https://mobile.twitter.com"" rel=""nofollow"">Twitter Web App</a>",https://mobile.twitter.com,Twitter Web App,https://pbs.twimg.com/media/EXaqMl-XgAUxCzX?format=jpg&name=small,https://pbs.twimg.com/media/EXaqMl-XgAUxCzX?format=jpg&name=large,photo,,,,,,,,,,,,,,,,,,,,,,,,,,,,,,,,,,,,,,,,,,,,,,,,,,,,,,,,,,,,,,,,,,,,,,,,,,,,,,,,,,,,,,,,,,,,,,,,,,,,,,,,,,,,,,,,,,,,,,,,,,,,,,,,,,,,,,,,,,,,,,,,,,,,,,,,,,,,,,,,,,,,,,,,,,,,,,,,,,,,,,,,,,,,,,,,,,,,,,,,,,,,,,,,,,,,,,,,,,,,,,,,,,,,,,,,,,,,,,,,,,,,,,,,,,,,,,,,,,,,,,,,,,,,,,,,,,,,,,,,,,,,,,,,,,,,,,,,,,,,,,,,,,,,,,,,,,,,,,,,,,,,,,,,,,,,,,,,,,,,,,,,,,,,,,,,,,,,,,,,,,,,,,,,,,,,,,,,,,,,,,,,,,,,,,,,,,,,,,,,,
https://twitter.com/UTK_TCE/status/1258123675007684611,2020-05-06T19:57:13+00:00,"2020 Faculty &amp; Staff Awards: Hannah Swan, our advisor for undergraduates in @UT_MSE, earned the 2020 Emerging Leader Award by embracing and strengthening her department's community above and beyond her role as an advisor: https://t.co/KOlLWaGzjV https://t.co/EwTu9JO972","2020 Faculty &amp; Staff Awards: Hannah Swan, our advisor for undergraduates in @UT_MSE, earned the 2020 Emerging Leader Award by embracing and strengthening her department's community above and beyond her role as an advisor: tickle.utk.edu/2020-faculty-s… https://t.co/EwTu9JO972",1258123675007684600,UTK_TCE,UTK TCE,2364325579,"Official Twitter for the Tickle College of Engineering at the University of Tennessee, Knoxville.","Official Twitter for the Tickle College of Engineering at the University of Tennessee, Knoxville.",false,2014-02-27T15:22:23+00:00,2018,471,4840,10109,28,649,"Knoxville, TN",false,http://tickle.utk.edu,https://t.co/5K4ka5QzAp,https://pbs.twimg.com/profile_images/1300820597350506502/UfcjG-y-_normal.jpg,https://pbs.twimg.com/profile_banners/2364325579/1598974346,https://tickle.utk.edu/2020-faculty-staff-awards-announced/,https://t.co/KOlLWaGzjV,0,1,6,0,1258123675007684600,en,"<a href=""https://mobile.twitter.com"" rel=""nofollow"">Twitter Web App</a>",https://mobile.twitter.com,Twitter Web App,https://pbs.twimg.com/media/EXXAvupUEAAOr4I?format=jpg&name=small,https://pbs.twimg.com/media/EXXAvupUEAAOr4I?format=jpg&name=large,photo,,,UT_MSE,UT MSE,2292797580,,,,,,,,,,,,,,,,,,,,,,,,,,,,,,,,,,,,,,,,,,,,,,,,,,,,,,,,,,,,,,,,,,,,,,,,,,,,,,,,,,,,,,,,,,,,,,,,,,,,,,,,,,,,,,,,,,,,,,,,,,,,,,,,,,,,,,,,,,,,,,,,,,,,,,,,,,,,,,,,,,,,,,,,,,,,,,,,,,,,,,,,,,,,,,,,,,,,,,,,,,,,,,,,,,,,,,,,,,,,,,,,,,,,,,,,,,,,,,,,,,,,,,,,,,,,,,,,,,,,,,,,,,,,,,,,,,,,,,,,,,,,,,,,,,,,,,,,,,,,,,,,,,,,,,,,,,,,,,,,,,,,,,,,,,,,,,,,,,,,,,,,,,,,,,,,,,,,,,,,,,,,,,,,,,,,,,,,,,,,,,,,,,,,,,,,,,,,
https://twitter.com/UTK_TCE/status/1257761066064510976,2020-05-05T19:56:20+00:00,Knox County Mayor @GlennJacobsTN visited our campus to learn about our team's work in manufacturing face shields for healthcare workers in the fight against COVID-19. We’re so happy he stopped by to see how our Volunteer Spirit is put into action. https://t.co/keAmbFmCi8,Knox County Mayor @GlennJacobsTN visited our campus to learn about our team's work in manufacturing face shields for healthcare workers in the fight against COVID-19. We’re so happy he stopped by to see how our Volunteer Spirit is put into action. https://t.co/keAmbFmCi8,1257761066064511000,UTK_TCE,UTK TCE,2364325579,"Official Twitter for the Tickle College of Engineering at the University of Tennessee, Knoxville.","Official Twitter for the Tickle College of Engineering at the University of Tennessee, Knoxville.",false,2014-02-27T15:22:23+00:00,2018,471,4840,10109,28,649,"Knoxville, TN",false,http://tickle.utk.edu,https://t.co/5K4ka5QzAp,https://pbs.twimg.com/profile_images/1300820597350506502/UfcjG-y-_normal.jpg,https://pbs.twimg.com/profile_banners/2364325579/1598974346,,,0,3,22,1,1257761066064511000,en,"<a href=""https://mobile.twitter.com"" rel=""nofollow"">Twitter Web App</a>",https://mobile.twitter.com,Twitter Web App,https://pbs.twimg.com/media/EXR1eWnX0AAiU-X?format=jpg&name=small,https://pbs.twimg.com/media/EXR1eWnX0AAiU-X?format=jpg&name=large,photo,,,GlennJacobsTN,Glenn Jacobs,734096443561148400,,,,,,,,,,,,,,,,,,,,,,,,,,,,,,,,,,,,,,,,,,,,,,,,,,,,,,,,,,,,,,,,,,,,,,,,,,,,,,,,,,,,,,,,,,,,,,,,,,,,,,,,,,,,,,,,,,,,,,,,,,,,,,,,,,,,,,,,,,,,,,,,,,,,,,,,,,,,,,,,,,,,,,,,,,,,,,,,,,,,,,,,,,,,,,,,,,,,,,,,,,,,,,,,,,,,,,,,,,,,,,,,,,,,,,,,,,,,,,,,,,,,,,,,,,,,,,,,,,,,,,,,,,,,,,,,,,,,,,,,,,,,,,,,,,,,,https://pbs.twimg.com/media/EXR161RXQAA235n?format=jpg&name=small,https://pbs.twimg.com/media/EXR161RXQAA235n?format=jpg&name=large,photo,https://pbs.twimg.com/media/EXR2A81XYAEjWsx?format=jpg&name=small,https://pbs.twimg.com/media/EXR2A81XYAEjWsx?format=jpg&name=large,photo,https://pbs.twimg.com/media/EXR2HLXXYAAe5SN?format=jpg&name=small,https://pbs.twimg.com/media/EXR2HLXXYAAe5SN?format=jpg&name=large,photo,,,,,,,,,,,,,,,,,,,,,,,,,,,,,,,,,,,,,,,,,,,,,,,,,,,,,,,,,,,,,,,,,,,,,,,,,,,,,,,,,,,,,,,,,,,,,,,
https://twitter.com/UTK_TCE/status/1257676374166376448,2020-05-05T14:19:48+00:00,"#UTGrad2020: #EngineeringVol Adam Larkey, a 2020 industrial &amp; systems engineering grad, began his first career when he picked up the fiddle at age 6.
https://t.co/FyKlUop74j","#UTGrad2020: #EngineeringVol Adam Larkey, a 2020 industrial &amp; systems engineering grad, began his first career when he picked up the fiddle at age 6.
tickle.utk.edu/ut-grad-finds-…",1257676374166376400,UTK_TCE,UTK TCE,2364325579,"Official Twitter for the Tickle College of Engineering at the University of Tennessee, Knoxville.","Official Twitter for the Tickle College of Engineering at the University of Tennessee, Knoxville.",false,2014-02-27T15:22:23+00:00,2018,471,4840,10109,28,649,"Knoxville, TN",false,http://tickle.utk.edu,https://t.co/5K4ka5QzAp,https://pbs.twimg.com/profile_images/1300820597350506502/UfcjG-y-_normal.jpg,https://pbs.twimg.com/profile_banners/2364325579/1598974346,https://tickle.utk.edu/ut-grad-finds-common-ground-in-engineering-and-bluegrass/,https://t.co/FyKlUop74j,1,3,4,0,1257676374166376400,en,"<a href=""https://mobile.twitter.com"" rel=""nofollow"">Twitter Web App</a>",https://mobile.twitter.com,Twitter Web App,,,,,,,,,,,,,,,,,,,,,,,,,,,,,,,,,,,,,,,,,,,,,,,,,,,,,,,,,,,,,,,,,,,,,,,,,,,,,,,,,,,,,,,,,,,,,,,,,,,,,,,,,,,,,,,,,,,,,,,,,,,,,,,,,,,,,,,,,,,,,,,,,,,,,,,,,,,,,,,,,,,,,,,,,,,,,,,,,,,,,,,,,,,,,,,,,,,,,,,,,,,,,,,,,,,,,,,,,,,,,,,,,,,,,,,,,,,,,,,,,,,,,,,,,,,,,,,,,,,,,,,,,,,,,,,,,,,,,,,,,,,,,,,,,,,,,,,,,,,,,,,,,,,,,,,,,,,,,,,,,,,,,,,,,,,,,,,,,,,,,,,,,,,,,,,,,,,,,,,,,,,,,,,,,,,,,,,,,,,,,,,,,,,,,,,,,,,,,,,,,,,,
https://twitter.com/UTK_TCE/status/1257660141786234880,2020-05-05T13:15:18+00:00,"Today is #GivingTuesdayNow, a global day of giving &amp; unity in response to COVID-19. Some UT students have experienced loss of income, access to academic studies, health care, and/or food insecurity. This VolStarter fund directly helps UT students in need. https://t.co/zz4m5rTBFo","Today is #GivingTuesdayNow, a global day of giving &amp; unity in response to COVID-19. Some UT students have experienced loss of income, access to academic studies, health care, and/or food insecurity. This VolStarter fund directly helps UT students in need. volstarter.utk.edu/s/1341/utk/vol…",1257660141786235000,UTK_TCE,UTK TCE,2364325579,"Official Twitter for the Tickle College of Engineering at the University of Tennessee, Knoxville.","Official Twitter for the Tickle College of Engineering at the University of Tennessee, Knoxville.",false,2014-02-27T15:22:23+00:00,2018,471,4840,10109,28,649,"Knoxville, TN",false,http://tickle.utk.edu,https://t.co/5K4ka5QzAp,https://pbs.twimg.com/profile_images/1300820597350506502/UfcjG-y-_normal.jpg,https://pbs.twimg.com/profile_banners/2364325579/1598974346,https://volstarter.utk.edu/s/1341/utk/volstarter/interior.aspx?sid=1341&gid=2&pgid=14276,https://t.co/zz4m5rTBFo,0,0,0,0,1257660141786235000,en,"<a href=""https://mobile.twitter.com"" rel=""nofollow"">Twitter Web App</a>",https://mobile.twitter.com,Twitter Web App,,,,,,,,,,,,,,,,,,,,,,,,,,,,,,,,,,,,,,,,,,,,,,,,,,,,,,,,,,,,,,,,,,,,,,,,,,,,,,,,,,,,,,,,,,,,,,,,,,,,,,,,,,,,,,,,,,,,,,,,,,,,,,,,,,,,,,,,,,,,,,,,,,,,,,,,,,,,,,,,,,,,,,,,,,,,,,,,,,,,,,,,,,,,,,,,,,,,,,,,,,,,,,,,,,,,,,,,,,,,,,,,,,,,,,,,,,,,,,,,,,,,,,,,,,,,,,,,,,,,,,,,,,,,,,,,,,,,,,,,,,,,,,,,,,,,,,,,,,,,,,,,,,,,,,,,,,,,,,,,,,,,,,,,,,,,,,,,,,,,,,,,,,,,,,,,,,,,,,,,,,,,,,,,,,,,,,,,,,,,,,,,,,,,,,,,,,,,,,,,,,,,
https://twitter.com/UTK_TCE/status/1257371705657430016,2020-05-04T18:09:10+00:00,"Chris Cherry, @cee_utk, notes the dramatic downturn in micromobility use during the #covid19 pandemic. https://t.co/CJ0MOckigA","Chris Cherry, @cee_utk, notes the dramatic downturn in micromobility use during the #covid19 pandemic. wbir.com/article/money/…",1257371705657430000,UTK_TCE,UTK TCE,2364325579,"Official Twitter for the Tickle College of Engineering at the University of Tennessee, Knoxville.","Official Twitter for the Tickle College of Engineering at the University of Tennessee, Knoxville.",false,2014-02-27T15:22:23+00:00,2018,471,4840,10109,28,649,"Knoxville, TN",false,http://tickle.utk.edu,https://t.co/5K4ka5QzAp,https://pbs.twimg.com/profile_images/1300820597350506502/UfcjG-y-_normal.jpg,https://pbs.twimg.com/profile_banners/2364325579/1598974346,https://www.wbir.com/article/money/business/as-people-return-to-a-new-normal-ut-professors-study-how-scooter-bike-shares-are-affected/51-fdd07c52-07bf-4cc2-bd02-9b3c027b683e,https://t.co/CJ0MOckigA,0,0,4,1,1257371705657430000,en,"<a href=""https://mobile.twitter.com"" rel=""nofollow"">Twitter Web App</a>",https://mobile.twitter.com,Twitter Web App,,,,,,cee_utk,CEE at UTK,3425022070,,,,,,,,,,,,,,,,,,,,,,,,,,,,,,,,,,,,,,,,,,,,,,,,,,,,,,,,,,,,,,,,,,,,,,,,,,,,,,,,,,,,,,,,,,,,,,,,,,,,,,,,,,,,,,,,,,,,,,,,,,,,,,,,,,,,,,,,,,,,,,,,,,,,,,,,,,,,,,,,,,,,,,,,,,,,,,,,,,,,,,,,,,,,,,,,,,,,,,,,,,,,,,,,,,,,,,,,,,,,,,,,,,,,,,,,,,,,,,,,,,,,,,,,,,,,,,,,,,,,,,,,,,,,,,,,,,,,,,,,,,,,,,,,,,,,,,,,,,,,,,,,,,,,,,,,,,,,,,,,,,,,,,,,,,,,,,,,,,,,,,,,,,,,,,,,,,,,,,,,,,,,,,,,,,,,,,,,,,,,,,,,,,,,,,,,,,,,
https://twitter.com/UTK_TCE/status/1256259563986321408,2020-05-01T16:29:54+00:00,Professor Qiang He and Assistant Professor Shuai Li (@cee_utk) have paired expertise in environmental microbiology and infrastructureengineering to fight the spread of #COVID19 via designs of disease-resistant buildings: https://t.co/2eMMN5flLc https://t.co/Ckik3ehQr8,Professor Qiang He and Assistant Professor Shuai Li (@cee_utk) have paired expertise in environmental microbiology and infrastructureengineering to fight the spread of #COVID19 via designs of disease-resistant buildings: cee.utk.edu/disease-resist… https://t.co/Ckik3ehQr8,1256259563986321400,UTK_TCE,UTK TCE,2364325579,"Official Twitter for the Tickle College of Engineering at the University of Tennessee, Knoxville.","Official Twitter for the Tickle College of Engineering at the University of Tennessee, Knoxville.",false,2014-02-27T15:22:23+00:00,2018,471,4840,10109,28,649,"Knoxville, TN",false,http://tickle.utk.edu,https://t.co/5K4ka5QzAp,https://pbs.twimg.com/profile_images/1300820597350506502/UfcjG-y-_normal.jpg,https://pbs.twimg.com/profile_banners/2364325579/1598974346,https://cee.utk.edu/disease-resistant-buildings-and-infrastructure-for-resilience-to-covid-19/,https://t.co/2eMMN5flLc,0,1,2,1,1256259563986321400,en,"<a href=""https://mobile.twitter.com"" rel=""nofollow"">Twitter Web App</a>",https://mobile.twitter.com,Twitter Web App,https://pbs.twimg.com/media/EW8hW3aWsAMbkw0?format=jpg&name=small,https://pbs.twimg.com/media/EW8hW3aWsAMbkw0?format=jpg&name=large,photo,,,cee_utk,CEE at UTK,3425022070,,,,,,,,,,,,,,,,,,,,,,,,,,,,,,,,,,,,,,,,,,,,,,,,,,,,,,,,,,,,,,,,,,,,,,,,,,,,,,,,,,,,,,,,,,,,,,,,,,,,,,,,,,,,,,,,,,,,,,,,,,,,,,,,,,,,,,,,,,,,,,,,,,,,,,,,,,,,,,,,,,,,,,,,,,,,,,,,,,,,,,,,,,,,,,,,,,,,,,,,,,,,,,,,,,,,,,,,,,,,,,,,,,,,,,,,,,,,,,,,,,,,,,,,,,,,,,,,,,,,,,,,,,,,,,,,,,,,,,,,,,,,,,,,,,,,,,,,,,,,,,,,,,,,,,,,,,,,,,,,,,,,,,,,,,,,,,,,,,,,,,,,,,,,,,,,,,,,,,,,,,,,,,,,,,,,,,,,,,,,,,,,,,,,,,,,,,,,
https://twitter.com/UTK_TCE/status/1255866037792366594,2020-04-30T14:26:10+00:00,"Congratulations, Lauren, Brooks, and Parker! #EngineeringVols https://t.co/cCde1js1hU","Congratulations, Lauren, Brooks, and Parker! #EngineeringVols twitter.com/UTKMABE/status…",1255866037792366600,UTK_TCE,UTK TCE,2364325579,"Official Twitter for the Tickle College of Engineering at the University of Tennessee, Knoxville.","Official Twitter for the Tickle College of Engineering at the University of Tennessee, Knoxville.",false,2014-02-27T15:22:23+00:00,2018,471,4840,10109,28,649,"Knoxville, TN",false,http://tickle.utk.edu,https://t.co/5K4ka5QzAp,https://pbs.twimg.com/profile_images/1300820597350506502/UfcjG-y-_normal.jpg,https://pbs.twimg.com/profile_banners/2364325579/1598974346,https://twitter.com/UTKMABE/status/1255841765371904002,https://t.co/cCde1js1hU,2,1,17,0,1255866037792366600,en,"<a href=""https://mobile.twitter.com"" rel=""nofollow"">Twitter Web App</a>",https://mobile.twitter.com,Twitter Web App,,,,,,,,,,,,,,,,,,,,,,,,,,,,,,,,,,,,,,,,,,,,,,,,,,,,,,,,,,,,,,,,,,,,https://twitter.com/UTKMABE/status/1255841765371904002,2020-04-30T12:49:43+00:00,"Congratulations to Lauren Jennings, Brooks Leftwich, and Parker Trulove on receiving the Chancellor's Extraordinary Academic Achievement Award. https://t.co/Pp8EeChzed","Congratulations to Lauren Jennings, Brooks Leftwich, and Parker Trulove on receiving the Chancellor's Extraordinary Academic Achievement Award. https://t.co/Pp8EeChzed",1255841765371904000,UTKMABE,UTK MABE,2749444435,"The official Twitter for UT's department of mechanical, aerospace, and biomedical engineering.","The official Twitter for UT's department of mechanical, aerospace, and biomedical engineering.",false,2014-08-20T15:48:55+00:00,589,220,1096,1221,10,134,Knoxville Tennessee,false,http://mabe.utk.edu/,http://t.co/zzMX7qNFEG,https://pbs.twimg.com/profile_images/601035163057967104/QfhUx-pF_normal.png,https://pbs.twimg.com/profile_banners/2749444435/1408636252,0,0,17,2,1255841765371904000,en,"<a href=""https://mobile.twitter.com"" rel=""nofollow"">Twitter Web App</a>",https://mobile.twitter.com,Twitter Web App,https://pbs.twimg.com/media/EW2lNa-XkAIHvm4?format=jpg&name=small,https://pbs.twimg.com/media/EW2lNa-XkAIHvm4?format=jpg&name=large,photo,,,,,,,,,,,,,,,,,,,,,,,,,,,,,https://pbs.twimg.com/media/EW2lQDDXYAIGX4M?format=jpg&name=small,https://pbs.twimg.com/media/EW2lQDDXYAIGX4M?format=jpg&name=large,photo,https://pbs.twimg.com/media/EW2lSSwXQAA2nVq?format=jpg&name=small,https://pbs.twimg.com/media/EW2lSSwXQAA2nVq?format=jpg&name=large,photo,,,,,,,,,,,,,,,,,,,,,,,,,,,,,,,,,,,,,,,,,,,,,,,,,,,,,,,,,,,,,,,,,,,,,,,,,,,,,,,,,,,,,,,,,,,,,,,,,,,,,,,,,,,,,,,,,,,,,,,,,,,,,,,,,,,,,,,,,,,,,,,,,,,,,,,,,,,,,,,,,,,,,,,,,,,,,,,,,,,,,,,,,,,,,,,,,,,,,,,,,,,,,,,,,,,,,,,,,,,,,,,,,,,,,,,,,,,,,,,,,,,,,,,,,,,,,,,,,,,,,,,,,,,
https://twitter.com/UTK_TCE/status/1255597430923550720,2020-04-29T20:38:50+00:00,"#EngineeringVol Alec Yen (@EECS_UTK) of Tullahoma, Tennessee, earned a Chancellor's Honor as an Undergraduate Researcher of the Year: https://t.co/haXxwviBpw https://t.co/Tt0lpjxt2c","#EngineeringVol Alec Yen (@EECS_UTK) of Tullahoma, Tennessee, earned a Chancellor's Honor as an Undergraduate Researcher of the Year: honorsbanquet.utk.edu/2020-undergrad… https://t.co/Tt0lpjxt2c",1255597430923550700,UTK_TCE,UTK TCE,2364325579,"Official Twitter for the Tickle College of Engineering at the University of Tennessee, Knoxville.","Official Twitter for the Tickle College of Engineering at the University of Tennessee, Knoxville.",false,2014-02-27T15:22:23+00:00,2018,471,4840,10109,28,649,"Knoxville, TN",false,http://tickle.utk.edu,https://t.co/5K4ka5QzAp,https://pbs.twimg.com/profile_images/1300820597350506502/UfcjG-y-_normal.jpg,https://pbs.twimg.com/profile_banners/2364325579/1598974346,https://honorsbanquet.utk.edu/2020-undergraduate-researcher-of-the-year/,https://t.co/haXxwviBpw,0,0,1,0,1255592337536946200,en,"<a href=""https://mobile.twitter.com"" rel=""nofollow"">Twitter Web App</a>",https://mobile.twitter.com,Twitter Web App,https://pbs.twimg.com/media/EWzHBJAWsAMfTjh?format=jpg&name=small,https://pbs.twimg.com/media/EWzHBJAWsAMfTjh?format=jpg&name=large,photo,,,EECS_UTK,EECS,425890664,,,,,,,,,,,,,,,,,,,,,,,,,,,,,,,,,,,,,,,,,,,,,,,,,,,,,,,,,,,,,,,,,,,,,,,,,,,,,,,,,,,,,,,,,,,,,,,,,,,,,,,,,,,,,,,,,,,,,,,,,,,,,,,,,,,,,,,,,,,,,,,,,,,,,,,,,,,,,,,,,,,,,,,,,,,,,,,,,,,,,,,,,,,,,,,,,,,,,,,,,,,,,,,,,,,,,,,,,,,,,,,,,,,,,,,,,,,,,,,,,,,,,,,,,,,,,,,,,,,,,,,,,,,,,,,,,,,,,,,,,,,,,,,,,,,,,,,,,,,,,,,,,,,,,,,,,,,,,,,,,,,,,,,,,,,,,,,,,,,,,,,,,,,,,,,,,,,,,,,,,,,,,,,,,,,,,,,,,,,,,,,,,,,,,,,,,,,,
https://twitter.com/UTK_TCE/status/1255596840864690176,2020-04-29T20:36:29+00:00,Congratulations to our #EngineeringVols who earned the Chancellor's Honors 2020 Extraordinary Academic Achievement awards: https://t.co/eeuMrltTUa https://t.co/5LejKHRW7r,Congratulations to our #EngineeringVols who earned the Chancellor's Honors 2020 Extraordinary Academic Achievement awards: honorsbanquet.utk.edu/2020-extraordi… https://t.co/5LejKHRW7r,1255596840864690200,UTK_TCE,UTK TCE,2364325579,"Official Twitter for the Tickle College of Engineering at the University of Tennessee, Knoxville.","Official Twitter for the Tickle College of Engineering at the University of Tennessee, Knoxville.",false,2014-02-27T15:22:23+00:00,2018,471,4840,10109,28,649,"Knoxville, TN",false,http://tickle.utk.edu,https://t.co/5K4ka5QzAp,https://pbs.twimg.com/profile_images/1300820597350506502/UfcjG-y-_normal.jpg,https://pbs.twimg.com/profile_banners/2364325579/1598974346,https://honorsbanquet.utk.edu/2020-extraordinary-academic-achievement/,https://t.co/eeuMrltTUa,1,0,0,0,1255592337536946200,en,"<a href=""https://mobile.twitter.com"" rel=""nofollow"">Twitter Web App</a>",https://mobile.twitter.com,Twitter Web App,https://pbs.twimg.com/media/EWzGpPMXQAU5sPd?format=jpg&name=small,https://pbs.twimg.com/media/EWzGpPMXQAU5sPd?format=jpg&name=large,photo,,,,,,,,,,,,,,,,,,,,,,,,,,,,,,,,,,,,,,,,,,,,,,,,,,,,,,,,,,,,,,,,,,,,,,,,,,,,,,,,,,,,,,,,,,,,,,,,,,,,,,,,,,,,,,,,,,,,,,,,,,,,,,,,,,,,,,,,,,,,,,,,,,,,,,,,,,,,,,,,,,,,,,,,,,,,,,,,,,,,,,,,,,,,,,,,,,,,,,,,,,,,,,,,,,,,,,,,,,,,,,,,,,,,,,,,,,,,,,,,,,,,,,,,,,,,,,,,,,,,,,,,,,,,,,,,,,,,,,,,,,,,,,,,,,,,,,,,,,,,,,,,,,,,,,,,,,,,,,,,,,,,,,,,,,,,,,,,,,,,,,,,,,,,,,,,,,,,,,,,,,,,,,,,,,,,,,,,,,,,,,,,,,,,,,,,,,,,,,,,,
https://twitter.com/UTK_TCE/status/1255596361300525056,2020-04-29T20:34:35+00:00,Congratulations to #EngineeringVols among the Chancellor's Honors 2020 Top Collegiate Scholars: https://t.co/FhtQpM9e5h https://t.co/9dsgW8gVak,Congratulations to #EngineeringVols among the Chancellor's Honors 2020 Top Collegiate Scholars: honorsbanquet.utk.edu/2020-top-colle… https://t.co/9dsgW8gVak,1255596361300525000,UTK_TCE,UTK TCE,2364325579,"Official Twitter for the Tickle College of Engineering at the University of Tennessee, Knoxville.","Official Twitter for the Tickle College of Engineering at the University of Tennessee, Knoxville.",false,2014-02-27T15:22:23+00:00,2018,471,4840,10109,28,649,"Knoxville, TN",false,http://tickle.utk.edu,https://t.co/5K4ka5QzAp,https://pbs.twimg.com/profile_images/1300820597350506502/UfcjG-y-_normal.jpg,https://pbs.twimg.com/profile_banners/2364325579/1598974346,https://honorsbanquet.utk.edu/2020-top-collegiate-scholars/,https://t.co/FhtQpM9e5h,1,0,0,0,1255592337536946200,en,"<a href=""https://mobile.twitter.com"" rel=""nofollow"">Twitter Web App</a>",https://mobile.twitter.com,Twitter Web App,https://pbs.twimg.com/media/EWzGMoKWAAELCZy?format=jpg&name=small,https://pbs.twimg.com/media/EWzGMoKWAAELCZy?format=jpg&name=large,photo,,,,,,,,,,,,,,,,,,,,,,,,,,,,,,,,,,,,,,,,,,,,,,,,,,,,,,,,,,,,,,,,,,,,,,,,,,,,,,,,,,,,,,,,,,,,,,,,,,,,,,,,,,,,,,,,,,,,,,,,,,,,,,,,,,,,,,,,,,,,,,,,,,,,,,,,,,,,,,,,,,,,,,,,,,,,,,,,,,,,,,,,,,,,,,,,,,,,,,,,,,,,,,,,,,,,,,,,,,,,,,,,,,,,,,,,,,,,,,,,,,,,,,,,,,,,,,,,,,,,,,,,,,,,,,,,,,,,,,,,,,,,,,,,,,,,,,,,,,,,,,,,,,,,,,,,,,,,,,,,,,,,,,,,,,,,,,,,,,,,,,,,,,,,,,,,,,,,,,,,,,,,,,,,,,,,,,,,,,,,,,,,,,,,,,,,,,,,,,,,,
