https://twitter.com/UTK_TCE/status/1197154880412114946,2019-11-20T14:09:00+00:00,"Getting the Band Back Together: An ISE project-management class celebrated the 150th anniversary of @potsband with the creation of an exhibit about the band’s history and legacy, viewable in the Student Union through December 4. https://t.co/R53YX9bYPl","Getting the Band Back Together: An ISE project-management class celebrated the 150th anniversary of @potsband with the creation of an exhibit about the band’s history and legacy, viewable in the Student Union through December 4. tickle.utk.edu/engineering-vo…",1197154880412115000,UTK_TCE,UTK TCE,2364325579,"Official Twitter for the Tickle College of Engineering at the University of Tennessee, Knoxville.","Official Twitter for the Tickle College of Engineering at the University of Tennessee, Knoxville.",false,2014-02-27T15:22:23+00:00,2018,471,4840,10109,28,649,"Knoxville, TN",false,http://tickle.utk.edu,https://t.co/5K4ka5QzAp,https://pbs.twimg.com/profile_images/1300820597350506502/UfcjG-y-_normal.jpg,https://pbs.twimg.com/profile_banners/2364325579/1598974346,http://tickle.utk.edu/engineering-vols-honor-ut-band-via-project-management,https://t.co/R53YX9bYPl,0,0,2,0,1197154880412115000,en,"<a href=""https://about.twitter.com/products/tweetdeck"" rel=""nofollow"">TweetDeck</a>",https://about.twitter.com/products/tweetdeck,TweetDeck,,,,,,potsband,UT Bands,3207545105,,,,,,,,,,,,,,,,,,,,,,,,,,,,,,,,,,,,,,,,,,,,,,,,,,,,,,,,,,,,,,,,,,,,,,,,,,,,,,,,,,,,,,,,,,,,,,,,,,,,,,,,,,,,,,,,,,,,,,,,,,,,,,,,,,,,,,,,,,,,,,,,,,,,,,,,,,,,,,,,,,,,,,,,,,,,,,,,,,,,,,,,,,,,,,,,,,,,,,,,,,,,,,,,,,,,,,,,,,,,,,,,,,,,,,,,,,,,,,,,,,,,,,,,,,,,,,,,,,,,,,,,,,,,,,,,,,,,,,,,,,,,,,,,,,,,,,,,,,,,,,,,,,,,,,,,,,,,,,,,,,,,,,,,,,,,,,,,,,,,,,,,,,,,,,,,,,,,,,,,,,,,,,,,,,,,,,,,,,,,,,,,,,,,,,,,,,,,
https://twitter.com/UTK_TCE/status/1196876132349435905,2019-11-19T19:41:21+00:00,We will offer a graduate certificate to amplify our focus on the ever-increasing worldwide role of #advancedmanufacturing beginning in January 2020. https://t.co/ZGQyyRiQDU,We will offer a graduate certificate to amplify our focus on the ever-increasing worldwide role of #advancedmanufacturing beginning in January 2020. tickle.utk.edu/ut-adds-advanc…,1196876132349436000,UTK_TCE,UTK TCE,2364325579,"Official Twitter for the Tickle College of Engineering at the University of Tennessee, Knoxville.","Official Twitter for the Tickle College of Engineering at the University of Tennessee, Knoxville.",false,2014-02-27T15:22:23+00:00,2018,471,4840,10109,28,649,"Knoxville, TN",false,http://tickle.utk.edu,https://t.co/5K4ka5QzAp,https://pbs.twimg.com/profile_images/1300820597350506502/UfcjG-y-_normal.jpg,https://pbs.twimg.com/profile_banners/2364325579/1598974346,https://tickle.utk.edu/ut-adds-advanced-manufacturing-certificate-considers-degree-program/,https://t.co/ZGQyyRiQDU,0,2,6,0,1196876132349436000,en,"<a href=""https://mobile.twitter.com"" rel=""nofollow"">Twitter Web App</a>",https://mobile.twitter.com,Twitter Web App,,,,,,,,,,,,,,,,,,,,,,,,,,,,,,,,,,,,,,,,,,,,,,,,,,,,,,,,,,,,,,,,,,,,,,,,,,,,,,,,,,,,,,,,,,,,,,,,,,,,,,,,,,,,,,,,,,,,,,,,,,,,,,,,,,,,,,,,,,,,,,,,,,,,,,,,,,,,,,,,,,,,,,,,,,,,,,,,,,,,,,,,,,,,,,,,,,,,,,,,,,,,,,,,,,,,,,,,,,,,,,,,,,,,,,,,,,,,,,,,,,,,,,,,,,,,,,,,,,,,,,,,,,,,,,,,,,,,,,,,,,,,,,,,,,,,,,,,,,,,,,,,,,,,,,,,,,,,,,,,,,,,,,,,,,,,,,,,,,,,,,,,,,,,,,,,,,,,,,,,,,,,,,,,,,,,,,,,,,,,,,,,,,,,,,,,,,,,,,,,,,,,
https://twitter.com/UTK_TCE/status/1196828004237733888,2019-11-19T16:30:06+00:00,"Faculty representation factor is high at #SC19 — Michela Taufer is chair and Lynne Parker (professor, former interim dean, and Assistant Director for Artificial Intelligence at @WHOSTP) will present. @Supercomputing https://t.co/THSiEeZ1bb","Faculty representation factor is high at #SC19 — Michela Taufer is chair and Lynne Parker (professor, former interim dean, and Assistant Director for Artificial Intelligence at @WHOSTP) will present. @Supercomputing twitter.com/EECS_UTK/statu…",1196828004237734000,UTK_TCE,UTK TCE,2364325579,"Official Twitter for the Tickle College of Engineering at the University of Tennessee, Knoxville.","Official Twitter for the Tickle College of Engineering at the University of Tennessee, Knoxville.",false,2014-02-27T15:22:23+00:00,2018,471,4840,10109,28,649,"Knoxville, TN",false,http://tickle.utk.edu,https://t.co/5K4ka5QzAp,https://pbs.twimg.com/profile_images/1300820597350506502/UfcjG-y-_normal.jpg,https://pbs.twimg.com/profile_banners/2364325579/1598974346,https://twitter.com/EECS_UTK/status/1196808824004284418,https://t.co/THSiEeZ1bb,0,1,5,0,1196828004237734000,en,"<a href=""https://mobile.twitter.com"" rel=""nofollow"">Twitter Web App</a>",https://mobile.twitter.com,Twitter Web App,,,,,,WHOSTP,White House OSTP,835178526093488100,,,,,,,,,,,,,,,,,,Supercomputing,SC20,19097159,,,,,,,,,,,,,,,,,,,,,,,,,,,,,,,,,,,,,,,,https://twitter.com/EECS_UTK/status/1196808824004284418,2019-11-19T15:13:53+00:00,"The SC19 Supercomputing conference, chaired by EECS Professor Michela Taufer, is underway in Denver. Invited speaker &amp; EECS Professor, Lynne Parker, will talk today on the topic of “US Administration Activities in Artificial Intelligence and HPC.” https://t.co/iGQQrtV1ZF https://t.co/dXzm1hJONw","The SC19 Supercomputing conference, chaired by EECS Professor Michela Taufer, is underway in Denver. Invited speaker &amp; EECS Professor, Lynne Parker, will talk today on the topic of “US Administration Activities in Artificial Intelligence and HPC.” tiny.utk.edu/sFQxI https://t.co/dXzm1hJONw",1196808824004284400,EECS_UTK,EECS,425890664,"The official Twitter account of the Min H. Kao Department of Electrical Engineering and Computer Science at the University of Tennessee, Knoxville.","The official Twitter account of the Min H. Kao Department of Electrical Engineering and Computer Science at the University of Tennessee, Knoxville.",false,2011-12-01T15:27:30+00:00,1133,1920,1193,6,12,554,"Knoxville, Tenn.",false,http://eecs.utk.edu,http://t.co/Xhx6ImT1zc,https://pbs.twimg.com/profile_images/571406781121712128/EGEWLvSu_normal.png,https://pbs.twimg.com/profile_banners/425890664/1515437344,0,2,8,1,1196808824004284400,en,"<a href=""https://mobile.twitter.com"" rel=""nofollow"">Twitter Web App</a>",https://mobile.twitter.com,Twitter Web App,https://pbs.twimg.com/media/EJvrRxRUcAA-BOg?format=jpg&name=small,https://pbs.twimg.com/media/EJvrRxRUcAA-BOg?format=jpg&name=large,photo,,,,https://tiny.utk.edu/sFQxI,https://t.co/iGQQrtV1ZF,,,,,,,,,,,,,,,,,,,,,,,,https://pbs.twimg.com/media/EJvrRxPUcAA8L6b?format=jpg&name=small,https://pbs.twimg.com/media/EJvrRxPUcAA8L6b?format=jpg&name=large,photo,,,,,,,,,,,,,,,,,,,,,,,,,,,,,,,,,,,,,,,,,,,,,,,,,,,,,,,,,,,,,,,,,,,,,,,,,,,,,,,,,,,,,,,,,,,,,,,,,,,,,,,,,,,,,,,,,,,,,,,,,,,,,,,,,,,,,,,,,,,,,,,,,,,,,,,,,,,,,,,,,,,,,,,,,,,,,,,,,,,,,,,,,,,,,,,,,,,,,,,,,,,,,,,,,,,,,,,,,,,,,,,,,,,,,,,,,,,,,,,,,,,,,,,,,,,,,,,,,,,,,,,,,,,,,,
https://twitter.com/UTK_TCE/status/1196801725039906816,2019-11-19T14:45:41+00:00,"Whenever we have questions about high-performance computing, we ask Jack Dongarra. https://t.co/YD9YY88c9g","Whenever we have questions about high-performance computing, we ask Jack Dongarra. twitter.com/ICL_UTK/status…",1196801725039906800,UTK_TCE,UTK TCE,2364325579,"Official Twitter for the Tickle College of Engineering at the University of Tennessee, Knoxville.","Official Twitter for the Tickle College of Engineering at the University of Tennessee, Knoxville.",false,2014-02-27T15:22:23+00:00,2018,471,4840,10109,28,649,"Knoxville, TN",false,http://tickle.utk.edu,https://t.co/5K4ka5QzAp,https://pbs.twimg.com/profile_images/1300820597350506502/UfcjG-y-_normal.jpg,https://pbs.twimg.com/profile_banners/2364325579/1598974346,https://twitter.com/ICL_UTK/status/1196620519904169984,https://t.co/YD9YY88c9g,0,1,3,0,1196801725039906800,en,"<a href=""http://twitter.com/download/iphone"" rel=""nofollow"">Twitter for iPhone</a>",http://twitter.com/download/iphone,Twitter for iPhone,,,,,,,,,,,,,,,,,,,,,,,,,,,,,,,,,,,,,,,,,,,,,,,,,,,,,,,,,,,,,,,,,,,,https://twitter.com/ICL_UTK/status/1196620519904169984,2019-11-19T02:45:38+00:00,"LIVE @ The University of Tennessee Booth Number 575! Dr. Jack Dongarra delivers ""An Overview of High Performance Computing and Challenges for the Future""

#SC19 #HPCisNow #HPC https://t.co/XqoZhxwLsa","LIVE @ The University of Tennessee Booth Number 575! Dr. Jack Dongarra delivers ""An Overview of High Performance Computing and Challenges for the Future""

#SC19 #HPCisNow #HPC https://t.co/XqoZhxwLsa",1196620519904170000,ICL_UTK,ICL UTK,49043248,The Innovative Computing Laboratory (ICL) aspires to be a world leader in enabling technologies and software for scientific computing.,The Innovative Computing Laboratory (ICL) aspires to be a world leader in enabling technologies and software for scientific computing.,false,2009-06-20T16:13:04+00:00,622,41,3752,19,33,42,"Knoxville, Tennessee",false,http://www.icl.utk.edu/,https://t.co/u7H4HDDhh9,https://pbs.twimg.com/profile_images/702194480280113152/-yP0VPgk_normal.png,https://pbs.twimg.com/profile_banners/49043248/1456416099,0,5,13,1,1196620519904170000,en,"<a href=""https://about.twitter.com/products/tweetdeck"" rel=""nofollow"">TweetDeck</a>",https://about.twitter.com/products/tweetdeck,TweetDeck,https://pbs.twimg.com/media/EJtAA5gUYAA20Tk?format=jpg&name=small,https://pbs.twimg.com/media/EJtAA5gUYAA20Tk?format=jpg&name=large,photo,,,,,,,,,,,,,,,,,,,,,,,,,,,,,https://pbs.twimg.com/media/EJtAA5dU8AEwkAu?format=jpg&name=small,https://pbs.twimg.com/media/EJtAA5dU8AEwkAu?format=jpg&name=large,photo,,,,,,,,,,,,,,,,,,,,,,,,,,,,,,,,,,,,,,,,,,,,,,,,,,,,,,,,,,,,,,,,,,,,,,,,,,,,,,,,,,,,,,,,,,,,,,,,,,,,,,,,,,,,,,,,,,,,,,,,,,,,,,,,,,,,,,,,,,,,,,,,,,,,,,,,,,,,,,,,,,,,,,,,,,,,,,,,,,,,,,,,,,,,,,,,,,,,,,,,,,,,,,,,,,,,,,,,,,,,,,,,,,,,,,,,,,,,,,,,,,,,,,,,,,,,,,,,,,,,,,,,,,,,,,
https://twitter.com/UTK_TCE/status/1196550830809219074,2019-11-18T22:08:43+00:00,"Congratulations, Cody! Nice pitching. https://t.co/8owJKgTgxU","Congratulations, Cody! Nice pitching. twitter.com/ANS_org/status…",1196550830809219000,UTK_TCE,UTK TCE,2364325579,"Official Twitter for the Tickle College of Engineering at the University of Tennessee, Knoxville.","Official Twitter for the Tickle College of Engineering at the University of Tennessee, Knoxville.",false,2014-02-27T15:22:23+00:00,2018,471,4840,10109,28,649,"Knoxville, TN",false,http://tickle.utk.edu,https://t.co/5K4ka5QzAp,https://pbs.twimg.com/profile_images/1300820597350506502/UfcjG-y-_normal.jpg,https://pbs.twimg.com/profile_banners/2364325579/1598974346,https://twitter.com/ANS_org/status/1196550114359296000,https://t.co/8owJKgTgxU,0,0,4,0,1196550830809219000,en,"<a href=""https://mobile.twitter.com"" rel=""nofollow"">Twitter Web App</a>",https://mobile.twitter.com,Twitter Web App,,,,,,,,,,,,,,,,,,,,,,,,,,,,,,,,,,,,,,,,,,,,,,,,,,,,,,,,,,,,,,,,,,,,https://twitter.com/ANS_org/status/1196550114359296000,2019-11-18T22:05:52+00:00,Best Pitch Award went to Cody Wiggins ans.utk  @UTK_TCE #ANSMeeting https://t.co/RyBdr8oLfg,Best Pitch Award went to Cody Wiggins ans.utk  @UTK_TCE #ANSMeeting instagram.com/p/B5BdvOUBS-C/…,1196550114359296000,ANS_org,American Nuclear Society,46444980,"Founded in 1954, the American Nuclear Society is a not-for-profit organization whose goal is to advance the peaceful use of nuclear science & technology.","Founded in 1954, the American Nuclear Society is a not-for-profit organization whose goal is to advance the peaceful use of nuclear science & technology.",false,2009-06-11T17:55:58+00:00,28112,1364,23462,4010,588,5151,"La Grange Park, IL",false,http://ans.org,https://t.co/4gWW9eHGej,https://pbs.twimg.com/profile_images/1145770003612020736/PdK7Ox0U_normal.jpg,https://pbs.twimg.com/profile_banners/46444980/1597722060,0,0,6,1,1196550114359296000,en,"<a href=""http://instagram.com"" rel=""nofollow"">Instagram</a>",http://instagram.com,Instagram,,,,,,,https://www.instagram.com/p/B5BdvOUBS-C/?igshid=1q5gmuyh7f5g,https://t.co/RyBdr8oLfg,,,,UTK_TCE,UTK TCE,2364325579,,,,,,,,,,,,,,,,,,,,,,,,,,,,,,,,,,,,,,,,,,,,,,,,,,,,,,,,,,,,,,,,,,,,,,,,,,,,,,,,,,,,,,,,,,,,,,,,,,,,,,,,,,,,,,,,,,,,,,,,,,,,,,,,,,,,,,,,,,,,,,,,,,,,,,,,,,,,,,,,,,,,,,,,,,,,,,,,,,,,,,,,,,,,,,,,,,,,,,,,,,,,,,,,,,,,,,,,,,,,,,,,,,,,,,,,,,,,,,,,,,,,,,,,,,,,,,,,,,,,,,,,,,,,,,,,,,,,,,,,,,,,,,,,,,
https://twitter.com/UTK_TCE/status/1196521942783811586,2019-11-18T20:13:56+00:00,The Nuclear Regulatory Commission (@NRCgov)  has awarded UT three grants for student recruitment and faculty development. — @utkne. https://t.co/NhoAkGx1tW,The Nuclear Regulatory Commission (@NRCgov)  has awarded UT three grants for student recruitment and faculty development. — @utkne. ne.utk.edu/nrc-awards-ut-…,1196521942783811600,UTK_TCE,UTK TCE,2364325579,"Official Twitter for the Tickle College of Engineering at the University of Tennessee, Knoxville.","Official Twitter for the Tickle College of Engineering at the University of Tennessee, Knoxville.",false,2014-02-27T15:22:23+00:00,2018,471,4840,10109,28,649,"Knoxville, TN",false,http://tickle.utk.edu,https://t.co/5K4ka5QzAp,https://pbs.twimg.com/profile_images/1300820597350506502/UfcjG-y-_normal.jpg,https://pbs.twimg.com/profile_banners/2364325579/1598974346,https://ne.utk.edu/nrc-awards-ut-more-than-1m-in-academic-grants/,https://t.co/NhoAkGx1tW,0,0,8,0,1196521942783811600,en,"<a href=""https://mobile.twitter.com"" rel=""nofollow"">Twitter Web App</a>",https://mobile.twitter.com,Twitter Web App,,,,,,NRCgov,NRC,325581008,,,,,,,,,,,,,,,,,,utkne,University of Tennessee Nuclear Engineering,915285835649560600,,,,,,,,,,,,,,,,,,,,,,,,,,,,,,,,,,,,,,,,,,,,,,,,,,,,,,,,,,,,,,,,,,,,,,,,,,,,,,,,,,,,,,,,,,,,,,,,,,,,,,,,,,,,,,,,,,,,,,,,,,,,,,,,,,,,,,,,,,,,,,,,,,,,,,,,,,,,,,,,,,,,,,,,,,,,,,,,,,,,,,,,,,,,,,,,,,,,,,,,,,,,,,,,,,,,,,,,,,,,,,,,,,,,,,,,,,,,,,,,,,,,,,,,,,,,,,,,,,,,,,,,,,,,,,,,,,,,,,,,,,,,,,,,,,,,,,,,,,,,,,,,,,,,,,,,,,,,,,,,,,,,,,,,,,,,,,,,,,,,,,,,,,,,,,,,,,,,,,,,,,,,,,,,,,,,,,,,
https://twitter.com/UTK_TCE/status/1195443427447427072,2019-11-15T20:48:18+00:00,Materials science &amp; engineering is a popular complement to nuclear engineering for students interested in dual degrees. These #EngineeringVols share why they chose to double up with @UT_MSE &amp; @utkne. https://t.co/DPobEmSCov,Materials science &amp; engineering is a popular complement to nuclear engineering for students interested in dual degrees. These #EngineeringVols share why they chose to double up with @UT_MSE &amp; @utkne. ne.utk.edu/dual-degree-st…,1195443427447427000,UTK_TCE,UTK TCE,2364325579,"Official Twitter for the Tickle College of Engineering at the University of Tennessee, Knoxville.","Official Twitter for the Tickle College of Engineering at the University of Tennessee, Knoxville.",false,2014-02-27T15:22:23+00:00,2018,471,4840,10109,28,649,"Knoxville, TN",false,http://tickle.utk.edu,https://t.co/5K4ka5QzAp,https://pbs.twimg.com/profile_images/1300820597350506502/UfcjG-y-_normal.jpg,https://pbs.twimg.com/profile_banners/2364325579/1598974346,https://ne.utk.edu/dual-degree-students-get-a-leg-up/,https://t.co/DPobEmSCov,0,4,6,0,1195443427447427000,en,"<a href=""https://mobile.twitter.com"" rel=""nofollow"">Twitter Web App</a>",https://mobile.twitter.com,Twitter Web App,,,,,,UT_MSE,UT MSE,2292797580,,,,,,,,,,,,,,,,,,utkne,University of Tennessee Nuclear Engineering,915285835649560600,,,,,,,,,,,,,,,,,,,,,,,,,,,,,,,,,,,,,,,,,,,,,,,,,,,,,,,,,,,,,,,,,,,,,,,,,,,,,,,,,,,,,,,,,,,,,,,,,,,,,,,,,,,,,,,,,,,,,,,,,,,,,,,,,,,,,,,,,,,,,,,,,,,,,,,,,,,,,,,,,,,,,,,,,,,,,,,,,,,,,,,,,,,,,,,,,,,,,,,,,,,,,,,,,,,,,,,,,,,,,,,,,,,,,,,,,,,,,,,,,,,,,,,,,,,,,,,,,,,,,,,,,,,,,,,,,,,,,,,,,,,,,,,,,,,,,,,,,,,,,,,,,,,,,,,,,,,,,,,,,,,,,,,,,,,,,,,,,,,,,,,,,,,,,,,,,,,,,,,,,,,,,,,,,,,,,,,,
https://twitter.com/UTK_TCE/status/1195377327540035584,2019-11-15T16:25:38+00:00,Proud to see some #EngineeringVols taking part in this. https://t.co/DvzjcntaKo,Proud to see some #EngineeringVols taking part in this. twitter.com/utkfacserv/sta…,1195377327540035600,UTK_TCE,UTK TCE,2364325579,"Official Twitter for the Tickle College of Engineering at the University of Tennessee, Knoxville.","Official Twitter for the Tickle College of Engineering at the University of Tennessee, Knoxville.",false,2014-02-27T15:22:23+00:00,2018,471,4840,10109,28,649,"Knoxville, TN",false,http://tickle.utk.edu,https://t.co/5K4ka5QzAp,https://pbs.twimg.com/profile_images/1300820597350506502/UfcjG-y-_normal.jpg,https://pbs.twimg.com/profile_banners/2364325579/1598974346,https://twitter.com/utkfacserv/status/1195374016778948608,https://t.co/DvzjcntaKo,0,0,1,0,1195377327540035600,en,"<a href=""https://mobile.twitter.com"" rel=""nofollow"">Twitter Web App</a>",https://mobile.twitter.com,Twitter Web App,,,,,,,,,,,,,,,,,,,,,,,,,,,,,,,,,,,,,,,,,,,,,,,,,,,,,,,,,,,,,,,,,,,,https://twitter.com/utkfacserv/status/1195374016778948608,2019-11-15T16:12:29+00:00,"Here at #UTFacilitiesServices, we LOVE our #americorps and student workers! They’re a huge part of our @sustainableUT team, &amp; we couldn’t have the impact we have for green practices on campus without them. Help us thank our AmeriCorps and student workers for all they do for UT! https://t.co/wNdctmrawD","Here at #UTFacilitiesServices, we LOVE our #americorps and student workers! They’re a huge part of our @sustainableUT team, &amp; we couldn’t have the impact we have for green practices on campus without them. Help us thank our AmeriCorps and student workers for all they do for UT! https://t.co/wNdctmrawD",1195374016778948600,utkfacserv,Facilities Services,627653144,Facilities Services is responsible for the basic operation and continuous maintenance of the Main and Ag. campuses of The University of Tennessee.,Facilities Services is responsible for the basic operation and continuous maintenance of the Main and Ag. campuses of The University of Tennessee.,false,2012-07-05T19:18:52+00:00,1523,808,2131,1451,17,774,"Knoxville, Tennessee",false,http://fs.utk.edu,http://t.co/V8g3nQQoh6,https://pbs.twimg.com/profile_images/888028843365289984/dtPWUQr0_normal.jpg,https://pbs.twimg.com/profile_banners/627653144/1473861128,0,0,4,1,1195374016778948600,en,"<a href=""http://twitter.com/download/iphone"" rel=""nofollow"">Twitter for iPhone</a>",http://twitter.com/download/iphone,Twitter for iPhone,https://pbs.twimg.com/media/EJbSVMlWsAA90Gn?format=jpg&name=small,https://pbs.twimg.com/media/EJbSVMlWsAA90Gn?format=jpg&name=large,photo,,,,,,,,,sustainableUT,UT Office of Sustainability,221375729,,,,,,,,,,,,,,,,,,,,,,,,,,,,,,,,,,,,,,,,,,,,,,,,,,,,,,,,,,,,,,,,,,,,,,,,,,,,,,,,,,,,,,,,,,,,,,,,,,,,,,,,,,,,,,,,,,,,,,,,,,,,,,,,,,,,,,,,,,,,,,,,,,,,,,,,,,,,,,,,,,,,,,,,,,,,,,,,,,,,,,,,,,,,,,,,,,,,,,,,,,,,,,,,,,,,,,,,,,,,,,,,,,,,,,,,,,,,,,,,,,,,,,,,,,,,,,,,,,,,,,,,,,,,,,,,,,,,,,,,,,,,,,,,,,
https://twitter.com/UTK_TCE/status/1195350921687027712,2019-11-15T14:40:42+00:00,"Great #MicNite presentation from Keith Stanfill, and thanks to @utkne paparazzi prof @radioactivegan for documenting the evening. https://t.co/mUDmqRKfxf","Great #MicNite presentation from Keith Stanfill, and thanks to @utkne paparazzi prof @radioactivegan for documenting the evening. twitter.com/radioactivegan…",1195350921687027700,UTK_TCE,UTK TCE,2364325579,"Official Twitter for the Tickle College of Engineering at the University of Tennessee, Knoxville.","Official Twitter for the Tickle College of Engineering at the University of Tennessee, Knoxville.",false,2014-02-27T15:22:23+00:00,2018,471,4840,10109,28,649,"Knoxville, TN",false,http://tickle.utk.edu,https://t.co/5K4ka5QzAp,https://pbs.twimg.com/profile_images/1300820597350506502/UfcjG-y-_normal.jpg,https://pbs.twimg.com/profile_banners/2364325579/1598974346,https://twitter.com/radioactivegan/status/1195141354856341506,https://t.co/mUDmqRKfxf,0,1,6,0,1195350921687027700,en,"<a href=""https://mobile.twitter.com"" rel=""nofollow"">Twitter Web App</a>",https://mobile.twitter.com,Twitter Web App,,,,,,utkne,University of Tennessee Nuclear Engineering,915285835649560600,,,,,,,,,,,,,,,,,,radioactivegan,Jamie Coble,198984223,,,,,,,,,,,,,,,,,,,,,,,,,,,,,,,,,,,,,,,,https://twitter.com/radioactivegan/status/1195141354856341506,2019-11-15T00:47:58+00:00,@UTK_TCE professor Keith Stanfill on stage at #MicNite https://t.co/rIrAPNvYja,@UTK_TCE professor Keith Stanfill on stage at #MicNite https://t.co/rIrAPNvYja,1195141354856341500,radioactivegan,Jamie Coble,198984223,Bringing data analytics to nuclear power since 2010. @utkne Associate Professor.  #WomanInSTEM #LooksLikeAnEngineer she/her/hers,Bringing data analytics to nuclear power since 2010. @utkne Associate Professor.  #WomanInSTEM #LooksLikeAnEngineer she/her/hers,false,2010-10-05T18:54:03+00:00,471,844,1735,19841,3,326,,false,,,https://pbs.twimg.com/profile_images/1009470636408868864/NdwNxY2x_normal.jpg,https://pbs.twimg.com/profile_banners/198984223/1529633161,0,0,3,1,1195141354856341500,en,"<a href=""http://twitter.com/download/android"" rel=""nofollow"">Twitter for Android</a>",http://twitter.com/download/android,Twitter for Android,https://pbs.twimg.com/media/EJX-uMJXsAEOdRp?format=jpg&name=small,https://pbs.twimg.com/media/EJX-uMJXsAEOdRp?format=jpg&name=large,photo,,,,,,,,,UTK_TCE,UTK TCE,2364325579,,,,,,,,,,,,,,,,,,,,,,,,,,,,,,,,,,,,,,,,,,,,,,,,,,,,,,,,,,,,,,,,,,,,,,,,,,,,,,,,,,,,,,,,,,,,,,,,,,,,,,,,,,,,,,,,,,,,,,,,,,,,,,,,,,,,,,,,,,,,,,,,,,,,,,,,,,,,,,,,,,,,,,,,,,,,,,,,,,,,,,,,,,,,,,,,,,,,,,,,,,,,,,,,,,,,,,,,,,,,,,,,,,,,,,,,,,,,,,,,,,,,,,,,,,,,,,,,,,,,,,,,,,,,,,,,,,,,,,,,,,,,,,,,,,
https://twitter.com/UTK_TCE/status/1194979417639907328,2019-11-14T14:04:29+00:00,"Thank you, #EngineeringVols, for taking us beyond our #BigOrangeGive goal and almost doubling it. Also, @UTKnoxville received $2,555,511 for the day, passing the overall goal of $2.25 million in honor of our 225th year. That's the way to Vol, Vols! https://t.co/YvzDJLQsLY https://t.co/zf0AZ6M5ej","Thank you, #EngineeringVols, for taking us beyond our #BigOrangeGive goal and almost doubling it. Also, @UTKnoxville received $2,555,511 for the day, passing the overall goal of $2.25 million in honor of our 225th year. That's the way to Vol, Vols! bigorangegive.utk.edu/tickle/ https://t.co/zf0AZ6M5ej",1194979417639907300,UTK_TCE,UTK TCE,2364325579,"Official Twitter for the Tickle College of Engineering at the University of Tennessee, Knoxville.","Official Twitter for the Tickle College of Engineering at the University of Tennessee, Knoxville.",false,2014-02-27T15:22:23+00:00,2018,471,4840,10109,28,649,"Knoxville, TN",false,http://tickle.utk.edu,https://t.co/5K4ka5QzAp,https://pbs.twimg.com/profile_images/1300820597350506502/UfcjG-y-_normal.jpg,https://pbs.twimg.com/profile_banners/2364325579/1598974346,http://bigorangegive.utk.edu/tickle/,https://t.co/YvzDJLQsLY,0,4,8,0,1194979417639907300,en,"<a href=""https://mobile.twitter.com"" rel=""nofollow"">Twitter Web App</a>",https://mobile.twitter.com,Twitter Web App,https://pbs.twimg.com/media/EJVrcYNVUAEHgrN?format=jpg&name=small,https://pbs.twimg.com/media/EJVrcYNVUAEHgrN?format=jpg&name=large,photo,,,UTKnoxville,UT Knoxville,19773627,,,,,,,,,,,,,,,,,,,,,,,,,,,,,,,,,,,,,,,,,,,,,,,,,,,,,,,,,,,,,,,,,,,,,,,,,,,,,,,,,,,,,,,,,,,,,,,,,,,,,,,,,,,,,,,,,,,,,,,,,,,,,,,,,,,,,,,,,,,,,,,,,,,,,,,,,,,,,,,,,,,,,,,,,,,,,,,,,,,,,,,,,,,,,,,,,,,,,,,,,,,,,,,,,,,,,,,,,,,,,,,,,,,,,,,,,,,,,,,,,,,,,,,,,,,,,,,,,,,,,,,,,,,,,,,,,,,,,,,,,,,,,,,,,,,,,,,,,,,,,,,,,,,,,,,,,,,,,,,,,,,,,,,,,,,,,,,,,,,,,,,,,,,,,,,,,,,,,,,,,,,,,,,,,,,,,,,,,,,,,,,,,,,,,,,,,,,,
https://twitter.com/UTK_TCE/status/1194584281181511680,2019-11-13T11:54:21+00:00,It’s #BigOrangeGive:🍊 Show your love for @UTKnoxville/@UTK_TCE as we raise $2.25 million in honor of #utk225! Read about matching gifts from fellow #EngineeringVol alums that will multiply your support — and choose programs near &amp; dear to your heart: https://t.co/v7TDQGeo4J https://t.co/8EuzBXdSD6,It’s #BigOrangeGive:🍊 Show your love for @UTKnoxville/@UTK_TCE as we raise $2.25 million in honor of #utk225! Read about matching gifts from fellow #EngineeringVol alums that will multiply your support — and choose programs near &amp; dear to your heart: bigorangegive.utk.edu/tickle https://t.co/8EuzBXdSD6,1194584281181511700,UTK_TCE,UTK TCE,2364325579,"Official Twitter for the Tickle College of Engineering at the University of Tennessee, Knoxville.","Official Twitter for the Tickle College of Engineering at the University of Tennessee, Knoxville.",false,2014-02-27T15:22:23+00:00,2018,471,4840,10109,28,649,"Knoxville, TN",false,http://tickle.utk.edu,https://t.co/5K4ka5QzAp,https://pbs.twimg.com/profile_images/1300820597350506502/UfcjG-y-_normal.jpg,https://pbs.twimg.com/profile_banners/2364325579/1598974346,http://bigorangegive.utk.edu/tickle,https://t.co/v7TDQGeo4J,0,4,5,0,1194584281181511700,en,"<a href=""http://twitter.com/download/iphone"" rel=""nofollow"">Twitter for iPhone</a>",http://twitter.com/download/iphone,Twitter for iPhone,https://pbs.twimg.com/media/EJQEEa6WsAADmdT?format=jpg&name=small,https://pbs.twimg.com/media/EJQEEa6WsAADmdT?format=jpg&name=large,photo,,,UTKnoxville,UT Knoxville,19773627,,,,,,,,,,,,,,,,,,UTK_TCE,UTK TCE,2364325579,,,,,,,,,,,,,,,,,,,,,,,,,,,,,,,,,,,,,,,,,,,,,,,,,,,,,,,,,,,,,,,,,,,,,,,,,,,,,,,,,,,,,,,,,,,,,,,,,,,,,,,,,,,,,,,,,,,,,,,,,,,,,,,,,,,,,,,,,,,,,,,,,,,,,,,,,,,,,,,,,,,,,,,,,,,,,,,,,,,,,,,,,,,,,,,,,,,,,,,,,,,,,,,,,,,,,,,,,,,,,,,,,,,,,,,,,,,,,,,,,,,,,,,,,,,,,,,,,,,,,,,,,,,,,,,,,,,,,,,,,,,,,,,,,,,,,,,,,,,,,,,,,,,,,,,,,,,,,,,,,,,,,,,,,,,,,,,,,,,,,,,,,,,,,,,,,,,,,,,,,,,,,,,,,,,,,,,,
